{
  "schema_version": "n.human_llm_mathematics.publication_gate.v1",
  "paper_id": "ABF-001",
  "receipt_date": "2026-07-28",
  "release_target": "public_technical_review",
  "status": "PASS_PUBLIC_TECHNICAL_REVIEW",
  "source_identity": {
    "repository": "novakprotocol/N-Human-AI-Mathematics",
    "mathematical_source_commit": "45dbf87cb4a46dcbbce690da7a22cdd7f88cb052",
    "release_control_commit": "4afb398aeb0dbb937c1a0fa38e38c370cc5b999b",
    "package_sha256": "38e733f352a888b49fbcdb1482338bfc40b791dac87b456a3cda532b6d8744eb",
    "source_package_sha256": "1dd0a509a2342cd9155767ebbe7634934aaa24a8023107c8eec59b78d8327fd0",
    "manifest_sha256": "44059e59b6bb01d352f25431f009915b5baeaf742cecdca9d1fb86826b95e16f",
    "tag": "abf-001-public-review-v1",
    "release_url": "https://github.com/novakprotocol/N-Human-AI-Mathematics/releases/tag/abf-001-public-review-v1"
  },
  "gates": {
    "claim_boundary": {
      "status": "PASS",
      "evidence": [
        "papers/ABF-001/CLAIMS.md",
        "papers/ABF-001/manuscript/ABF-001_MANUSCRIPT.md",
        "papers/ABF-001/STATUS.json"
      ],
      "notes": "Active candidate public technical review only; no security, peer-review, external-reproduction, full-formalization, or worldwide-priority claim."
    },
    "proof": {
      "status": "PASS",
      "evidence": [
        "papers/ABF-001/PROOF_MAP.md",
        "papers/ABF-001/manuscript/ABF-001_MANUSCRIPT.md",
        "papers/ABF-001/FORMAL_VERIFICATION.md"
      ],
      "universal_claims_have_complete_human_proofs": true,
      "finite_claims_exhaustively_verified_or_not_applicable": true,
      "proof_assistant_status": "PARTIAL_PASS / bounded A01 Lean verification; A02-A06 and the full manuscript are not fully formalized"
    },
    "hostile_review": {
      "status": "PASS",
      "evidence": [
        "papers/ABF-001/review/FINAL_HOSTILE_REVIEW.md"
      ],
      "blocking_findings_open": 0
    },
    "prior_art_search": {
      "status": "PASS",
      "evidence": [
        "papers/ABF-001/literature/SEARCH_PROTOCOL.md",
        "papers/ABF-001/literature/PRIMARY_SOURCE_MAP.md",
        "papers/ABF-001/literature/FINAL_DELTA_SEARCH.md",
        "papers/ABF-001/literature/search-query-ledger-expanded.csv"
      ],
      "search_completed_to_declared_scope": true,
      "final_delta_search_completed": true,
      "final_delta_search_date": "2026-07-28",
      "historical_priority": "unestablished"
    },
    "independent_challenge": {
      "status": "PASS",
      "evidence": [
        "papers/ABF-001/src/abf001_independent_bitset.py",
        "papers/ABF-001/src/abf001_small_universe.py",
        "papers/ABF-001/evidence/independent-final/abf001-independent-bitset.json"
      ],
      "structurally_independent_internal_route": true,
      "external_reproduction": "pending"
    },
    "clean_execution": {
      "status": "PASS",
      "evidence": [
        "papers/ABF-001/qa/final-clean-execution-receipt.json",
        "papers/ABF-001/evidence/receipts/small-universe-final.json",
        "papers/ABF-001/evidence/receipts/tamper-control-final.json"
      ],
      "fresh_checkout_or_clean_copy": true,
      "completed_without_timeout": true,
      "partial_runs_accepted": false,
      "deterministic_receipt_present": true
    },
    "provenance": {
      "status": "PASS",
      "evidence": [
        "papers/ABF-001/SOURCE_SHA256SUMS.txt",
        "papers/ABF-001/ABF-001_RELEASE_CANDIDATE.json",
        "https://github.com/novakprotocol/N-Human-AI-Mathematics/releases/tag/abf-001-public-review-v1"
      ],
      "source_identity_locked": true,
      "sha256_manifest_present": true,
      "versioned_tag_present": true,
      "release_record_present": true
    },
    "owner_authorization": {
      "status": "PASS",
      "evidence": [
        "papers/ABF-001/OWNER_AUTHORIZATION.md"
      ],
      "package_specific_authorization": true,
      "notes": "Existing ABF-001 public candidate-review authorization is preserved."
    }
  },
  "limitations": [
    "Historical priority remains unestablished.",
    "External specialist review and outside reproduction remain pending.",
    "A01 has bounded Lean verification, but the full manuscript is not fully Lean verified.",
    "No full-width cryptographic security or insecurity conclusion is claimed."
  ]
}